{
  "run_id": "RUN-20261002-02",
  "scenario_id": "C0015-LAB-1",
  "created_utc": "2026-10-02T03:45:00Z",
  "secrets_policy": "no-secrets-allowed",
  "stages": [
    {
      "stage": "S1",
      "host": "WS01",
      "account": "C0015\\duc.user",
      "status": "PASS",
      "input_artifacts": [],
      "output_artifacts": [],
      "evidence_refs": [
        { "kind": "E1", "detail": "WINWORD->mshta->regsvr32->powershell beacon (register phase3 S1-0f74f273ea6322c5 03:20:40Z)" },
        { "kind": "detection", "detail": "R01/R02/R07/R08 fire (1-3 alerts) tren window" }
      ],
      "notes": "Rerun detection-validation run: alerts closed truoc (open=0), 8 rules moi imported enabled"
    },
    {
      "stage": "S2-S3",
      "host": "WS01",
      "account": "C0015\\duc.user",
      "status": "PASS",
      "input_artifacts": [],
      "output_artifacts": [],
      "evidence_refs": [
        { "kind": "register", "detail": "phase3 token=S1-0f74f273ea6322c5 ok=True 03:20:40Z" },
        { "kind": "detection", "detail": "R04/R05/R06/R10 fire" }
      ],
      "notes": ""
    },
    {
      "stage": "S4",
      "host": "WS01",
      "account": "C0015\\duc.user",
      "status": "PASS",
      "input_artifacts": [],
      "output_artifacts": [],
      "evidence_refs": [
        { "kind": "tasking", "detail": "runbook c0015-phase2 (11 entries, queue drained)" },
        { "kind": "detection", "detail": "R11=6, R12=30-72 (sweep dup)" }
      ],
      "notes": ""
    },
    {
      "stage": "S5",
      "host": "WS01",
      "account": "C0015\\duc.user",
      "status": "PASS",
      "input_artifacts": [],
      "output_artifacts": [],
      "evidence_refs": [
        { "kind": "tasking", "detail": "net view \\\\FS01 + Get-SmbShare" },
        { "kind": "detection", "detail": "R13=17 (sweep dup)" }
      ],
      "notes": ""
    },
    {
      "stage": "S7",
      "host": "WS01/FS01",
      "account": "C0015\\it.admin",
      "status": "PASS",
      "input_artifacts": [],
      "output_artifacts": [],
      "evidence_refs": [
        { "kind": "detection", "detail": "R14a=27 (network logon); R14b=139 noise -> building block ON sau run" }
      ],
      "notes": "R14b tuned: 4672 by it.admin laplai do beacon elevated logon"
    },
    {
      "stage": "S7b",
      "host": "WS01",
      "account": "C0015\\it.admin",
      "status": "PASS",
      "input_artifacts": [],
      "output_artifacts": [],
      "evidence_refs": [
        { "kind": "E10", "detail": "mimikatz->lsass 0x1010 03:25:13Z" },
        { "kind": "detection", "detail": "R15 fire (3 alerts: 1 TP + 2 sweep dup)" }
      ],
      "notes": ""
    },
    {
      "stage": "S8a",
      "host": "FS01",
      "account": "C0015\\it.admin",
      "status": "PASS",
      "input_artifacts": [],
      "output_artifacts": [],
      "evidence_refs": [
        { "kind": "E11", "detail": "3 files tren C:\\C0015 (T1105 fetches + SMB C$)" },
        { "kind": "detection", "detail": "R16=0 (audit-gated - SENSOR GAP documented)" }
      ],
      "notes": ""
    },
    {
      "stage": "S8b",
      "host": "FS01",
      "account": "C0015\\it.admin",
      "status": "PASS",
      "input_artifacts": [],
      "output_artifacts": [],
      "evidence_refs": [
        { "kind": "E1", "detail": "rundll32 parent=WmiPrvSE cmd='...143_surrogate.dll LabEntry' 03:25:4xZ" },
        { "kind": "E7", "detail": "ImageLoad 143.dll hash=cbcd2a8b... (ART-06-01)" },
        { "kind": "detection", "detail": "R17 fire (9 alerts: 3 sweep x chain)" }
      ],
      "notes": ""
    },
    {
      "stage": "S9",
      "host": "FS01",
      "account": "C0015\\it.admin",
      "status": "PASS",
      "input_artifacts": [],
      "output_artifacts": ["ART-07-01"],
      "evidence_refs": [
        { "kind": "register", "detail": "phase7-session2 S1-37f2fcf212cd3a46 03:25:41Z -> receipt ART-07-01-12cd3a46" },
        { "kind": "detection", "detail": "R18=12 (sweep dup), R09=6" }
      ],
      "notes": ""
    }
  ],
  "artifact_index": [
    {
      "artifact_id": "ART-07-01",
      "path": "evidence/run-ledger/ART-07-01-12cd3a46.json",
      "sha256": "3697A6EA4B62F1BA7592FC613CFB2F32207212693935ECED0E83B3233A741DFF",
      "producer_stage": "S7",
      "consumer_stage": "S8"
    }
  ]
}